za 03 jan 2026 14:16:26 CET
;; 1. Based on: run01
;; 2. Description: PMX001 2CMT LINEAR M7+ (BASE MODEL)
;; Joshua I., Ali K.
;; 2025-12-09
$PROBLEM    PMX001 Two Compartment
$INPUT      DUMMY=DROP ID TIME WEEK DOSE=AMT RATE CONC=DROP ADA BW ALB
            SEX=DROP AGE=DROP CREAT COL EVID BLQ CONC_M7=DV
$DATA      ../../../../../../../../../dataset_clean.csv IGNORE=@
$ABBREVIATED DERIV2=NO
$SUBROUTINE ADVAN13 ; general nonlinear model
            TOL=9 ; tolerance for $DES,higher TOL: more accurate,but slower computation

; TOL=7 -> DES will aim for accuracy of 1E-7 for each integration step
$MODEL      NCOMP=2 ; number of compartments
            COMP=(DOSE,DEFDOSE,DEFOBS) ; first (central) compartment
            COMP=(PERIPH) ; second (peripheral) compartment
$PK
;;; V1BW-DEFINITION START
   V1BW = EXP(THETA(10)*(BW - 65.93))
;;; V1BW-DEFINITION END


;;; V1CREAT-DEFINITION START
V1CREAT = ( 1 + THETA(9)*(CREAT - 1.03))
;;; V1CREAT-DEFINITION END


;;; V1ALB-DEFINITION START
IF(ALB.LE.31.85) V1ALB = ( 1 + THETA(7)*(ALB - 31.85))
IF(ALB.GT.31.85) V1ALB = ( 1 + THETA(8)*(ALB - 31.85))
;;; V1ALB-DEFINITION END


;;; V1ADA-DEFINITION START
IF(ADA.EQ.0) V1ADA = 1  ; Most common
IF(ADA.EQ.1) V1ADA = ( 1 + THETA(6))
;;; V1ADA-DEFINITION END

;;; V1-RELATION START
V1COV=V1ADA*V1ALB*V1CREAT*V1BW
;;; V1-RELATION END


;;; CLADA-DEFINITION START
IF(ADA.EQ.0) CLADA = 1  ; Most common
IF(ADA.EQ.1) CLADA = ( 1 + THETA(5))
;;; CLADA-DEFINITION END

;;; CL-RELATION START
CLCOV=CLADA
;;; CL-RELATION END


IF (EVID.EQ.1) LASTDOSE = TIME
TAD = TIME - LASTDOSE

TVCL = THETA(1)

TVCL = CLCOV*TVCL
TVV1 = THETA(2)

TVV1 = V1COV*TVV1
TVV2 = THETA(3)
 TVQ = THETA(4)
   
  CL = TVCL * EXP(ETA(1))
  V1 = TVV1 * EXP(ETA(2))
  V2 = TVV2
   Q = TVQ
 
 K10 = CL/V1
 K12 = Q/V1
 K21 = Q/V2
 
  S1 = V1/1 ; scale prediction based on DOSE (mmol) and DV (mmol/L)
  S2 = V2/1

$THETA  (0.001,1.28813031681497,8) ; [1]   CL (L/d)
 (0.001,7.8412929032161,10) ; [2,3] V1  (L)
 (0.01,0.189330202211423,6) ; V2
 (0.001,1.31870871017456,6) ; Q
 ; values are determined in 3 iterations
$THETA  (-1,3.90567559152701,5) ; CLADA1
$THETA  (-1,-0.278706738504496,5) ; V1ADA1
$THETA  (-100000,0.0150677620334097,0.084) ; V1ALB1
 (-0.134,-0.131158571529225,100000) ; V1ALB2
$THETA  (-1.250,0.277508893625099,1.190) ; V1CREAT1
$THETA  (-0.191562819716643,0.0122035392176203,0.191562819716643) ; V1BW1
$DES DADT(1) = -K10*A(1) -K12*A(1) +K21*A(2) ; ODE for central    compartment
     DADT(2) =            K12*A(1) -K21*A(2) ; ODE for peripheral compartment
     
$ERROR
IPRED = F
LLOQ = 1  ; (mg/L)

; --- Residual error SDs ---
PROP_SD = SIGMA(1)
ADD_SD  = SIGMA(2)

; --- BLQ inflation (gentle, stable) ---
IF (BLQ.EQ.1) ADD_SD = ADD_SD + LLOQ

; --- Final residual error ---
W = SQRT(ADD_SD**2+PROP_SD**2)

IF (W.LE.0.000001) W=0.000001 ; Protective code

IRES=DV-IPRED
IWRES=IRES/W
Y = IPRED * (1 + EPS(1)) + EPS(2)

$OMEGA  0.60249098510706  ;     IIV CL
 0.388040490714129  ;      IIV V
$SIGMA  0.290859627025517  ; EPS(1), proportional
 5E-13  FIX  ;     EPS(2)  ; additive, required by M7+ censoring method
    ; residual variability
$ESTIMATION METHOD=1 INTERACTION ; FOCE-I
            SIG=3 SIGL=4 PRINT=5 MAXEVALS=9999 CTYPE=4


NM-TRAN MESSAGES
  
 WARNINGS AND ERRORS (IF ANY) FOR PROBLEM    1
             
 (WARNING  2) NM-TRAN INFERS THAT THE DATA ARE POPULATION.
             
 (WARNING  79) SIGMA IS USED ON THE RIGHT. WITH A SUBSEQUENT RUN, IF AN
 INITIAL ESTIMATE OF A DIAGONAL BLOCK OF SIGMA IS TO BE COMPUTED BY
 NONMEM, THAT BLOCK WILL BE SET TO AN IDENTITY MATRIX DURING THAT
 COMPUTATION. THIS COULD LEAD TO AN ARITHMETIC EXCEPTION.*

 * THE MAXIMUM NUMBER OF WARNINGS OF ONE OR MORE TYPES WAS REACHED.
 IT IS POSSIBLE THAT SOME WARNING MESSAGES WERE SUPPRESSED.

License Registered to: Erwin DREESEN KU Leuven
Expiration Date:    25 JAN 2026
Current Date:        3 JAN 2026
  **** WARNING!!! Days until program expires :  22 ****
  **** CONTACT idssoftware@iconplc.com FOR RENEWAL ****
1NONLINEAR MIXED EFFECTS MODEL PROGRAM (NONMEM) VERSION 7.6.0 (nm760)
 ORIGINALLY DEVELOPED BY STUART BEAL, LEWIS SHEINER, AND ALISON BOECKMANN
 CURRENT DEVELOPERS ARE ROBERT BAUER, ICON DEVELOPMENT SOLUTIONS,
 AND ALISON BOECKMANN. IMPLEMENTATION, EFFICIENCY, AND STANDARDIZATION
 PERFORMED BY NOUS INFOSYSTEMS.

 PROBLEM NO.:         1
 PMX001 Two Compartment
0DATA CHECKOUT RUN:              NO
 DATA SET LOCATED ON UNIT NO.:    2
 THIS UNIT TO BE REWOUND:        NO
 CREATE/ADD TO FDATA.csv:        YES
 NO. OF DATA RECS IN DATA SET:    11475
 NO. OF DATA ITEMS IN DATA SET:  14
 ID DATA ITEM IS DATA ITEM NO.:   1
 DEP VARIABLE IS DATA ITEM NO.:  13
 MDV DATA ITEM IS DATA ITEM NO.: 14
0INDICES PASSED TO SUBROUTINE PRED:
  11   2   4   5   0   0   0   0   0   0   0
0LABELS FOR DATA ITEMS:
 ID TIME WEEK DOSE RATE ADA BW ALB CREAT COL EVID BLQ CONC_M7 MDV
0FORMAT FOR DATA:
 (E2.0,E18.0,E2.0,2E16.0,E1.0,E16.0/E16.0,E17.0,3E1.0,E16.0,1F2.0)

 TOT. NO. OF OBS RECS:     2801
 TOT. NO. OF INDIVIDUALS:       75
0LENGTH OF THETA:  10
0DEFAULT THETA BOUNDARY TEST OMITTED:    NO
0OMEGA HAS SIMPLE DIAGONAL FORM WITH DIMENSION:   2
0DEFAULT OMEGA BOUNDARY TEST OMITTED:    NO
0SIGMA HAS BLOCK FORM:
  1
  0  2
0DEFAULT SIGMA BOUNDARY TEST OMITTED:    NO
0INITIAL ESTIMATE OF THETA:
 LOWER BOUND    INITIAL EST    UPPER BOUND
  0.1000E-02     0.1288E+01     0.8000E+01
  0.1000E-02     0.7841E+01     0.1000E+02
  0.1000E-01     0.1893E+00     0.6000E+01
  0.1000E-02     0.1319E+01     0.6000E+01
 -0.1000E+01     0.3906E+01     0.5000E+01
 -0.1000E+01    -0.2787E+00     0.5000E+01
 -0.1000E+06     0.1507E-01     0.8400E-01
 -0.1340E+00    -0.1312E+00     0.1000E+06
 -0.1250E+01     0.2775E+00     0.1190E+01
 -0.1916E+00     0.1220E-01     0.1916E+00
0INITIAL ESTIMATE OF OMEGA:
 0.6025E+00
 0.0000E+00   0.3880E+00
0INITIAL ESTIMATE OF SIGMA:
 BLOCK SET NO.   BLOCK                                                                    FIXED
        1                                                                                   NO
                  0.2909E+00
        2                                                                                  YES
                  0.5000E-12
1DOUBLE PRECISION PREDPP VERSION 7.6.0 (nm760)

 GENERAL NONLINEAR KINETICS MODEL WITH STIFF/NONSTIFF EQUATIONS (LSODA, ADVAN13)
0MODEL SUBROUTINE USER-SUPPLIED - ID NO. 9999
0MAXIMUM NO. OF BASIC PK PARAMETERS:   3
0COMPARTMENT ATTRIBUTES
 COMPT. NO.   FUNCTION   INITIAL    ON/OFF      DOSE      DEFAULT    DEFAULT
                         STATUS     ALLOWED    ALLOWED    FOR DOSE   FOR OBS.
    1         DOSE         ON         YES        YES        YES        YES
    2         PERIPH       ON         YES        YES        NO         NO
    3         OUTPUT       OFF        YES        NO         NO         NO
 INITIAL (BASE) TOLERANCE SETTINGS:
 NRD (RELATIVE) VALUE(S) OF TOLERANCE:   9
 ANRD (ABSOLUTE) VALUE(S) OF TOLERANCE:  12
1
 ADDITIONAL PK PARAMETERS - ASSIGNMENT OF ROWS IN GG
 COMPT. NO.                             INDICES
              SCALE      BIOAVAIL.   ZERO-ORDER  ZERO-ORDER  ABSORB
                         FRACTION    RATE        DURATION    LAG
    1            4           *           *           *           *
    2            5           *           *           *           *
    3            *           -           -           -           -
             - PARAMETER IS NOT ALLOWED FOR THIS MODEL
             * PARAMETER IS NOT SUPPLIED BY PK SUBROUTINE;
               WILL DEFAULT TO ONE IF APPLICABLE
0DATA ITEM INDICES USED BY PRED ARE:
   EVENT ID DATA ITEM IS DATA ITEM NO.:     11
   TIME DATA ITEM IS DATA ITEM NO.:          2
   DOSE AMOUNT DATA ITEM IS DATA ITEM NO.:   4
   DOSE RATE DATA ITEM IS DATA ITEM NO.:     5

0PK SUBROUTINE CALLED WITH EVERY EVENT RECORD.
 PK SUBROUTINE NOT CALLED AT NONEVENT (ADDITIONAL OR LAGGED) DOSE TIMES.
0ERROR SUBROUTINE CALLED WITH EVERY EVENT RECORD.
0DES SUBROUTINE USES COMPACT STORAGE MODE.
1


 #TBLN:      1
 #METH: First Order Conditional Estimation with Interaction

 ESTIMATION STEP OMITTED:                 NO
 SHRINK INFO WITH EVALUATION (EVALSHRINK) NO
 ANALYSIS TYPE:                           POPULATION
 NUMBER OF SADDLE POINT RESET ITERATIONS:      0
 GRADIENT METHOD USED:               NOSLOW
 CONDITIONAL ESTIMATES USED:              YES
 CENTERED ETA:                            NO
 EPS-ETA INTERACTION:                     YES
 LAPLACIAN OBJ. FUNC.:                    NO
 NO. OF FUNCT. EVALS. ALLOWED:            9999
 NO. OF SIG. FIGURES REQUIRED:            3
 INTERMEDIATE PRINTOUT:                   YES
 ESTIMATE OUTPUT TO MSF:                  NO
 IND. OBJ. FUNC. VALUES SORTED:           NO
 NUMERICAL DERIVATIVE
       FILE REQUEST (NUMDER):               NONE
 MAP (ETAHAT) ESTIMATION METHOD (OPTMAP):   0
 ETA HESSIAN EVALUATION METHOD (ETADER):    0
 INITIAL ETA FOR MAP ESTIMATION (MCETA):    0
 SIGDIGITS FOR MAP ESTIMATION (SIGLO):      4
 GRADIENT SIGDIGITS OF
       FIXED EFFECTS PARAMETERS (SIGL):     4
 NOPRIOR SETTING (NOPRIOR):                 0
 NOCOV SETTING (NOCOV):                     OFF
 DERCONT SETTING (DERCONT):                 OFF
 FINAL ETA RE-EVALUATION (FNLETA):          1
 EXCLUDE NON-INFLUENTIAL (NON-INFL.) ETAS
       IN SHRINKAGE (ETASTYPE):             NO
 NON-INFL. ETA CORRECTION (NONINFETA):      0
 RAW OUTPUT FILE (FILE): psn.ext
 EXCLUDE TITLE (NOTITLE):                   NO
 EXCLUDE COLUMN LABELS (NOLABEL):           NO
 FORMAT FOR ADDITIONAL FILES (FORMAT):      S1PE12.5
 PARAMETER ORDER FOR OUTPUTS (ORDER):       TSOL
 KNUTHSUMOFF:                               0
 INCLUDE LNTWOPI:                           NO
 INCLUDE CONSTANT TERM TO PRIOR (PRIORC):   NO
 INCLUDE CONSTANT TERM TO OMEGA (ETA) (OLNTWOPI):NO
 ADDITIONAL CONVERGENCE TEST (CTYPE=4)?:    YES
 EM OR BAYESIAN METHOD USED:                 NONE

 TOLERANCES FOR ESTIMATION/EVALUATION STEP:
 NRD (RELATIVE) VALUE(S) OF TOLERANCE:   9
 ANRD (ABSOLUTE) VALUE(S) OF TOLERANCE:  12
 TOLERANCES FOR COVARIANCE STEP:
 NRD (RELATIVE) VALUE(S) OF TOLERANCE:   9
 ANRD (ABSOLUTE) VALUE(S) OF TOLERANCE:  12

 THE FOLLOWING LABELS ARE EQUIVALENT
 PRED=PREDI
 RES=RESI
 WRES=WRESI
 IWRS=IWRESI
 IPRD=IPREDI
 IRS=IRESI

 MONITORING OF SEARCH:


0ITERATION NO.:    0    OBJECTIVE VALUE:   10802.0070146163        NO. OF FUNC. EVALS.:  13
 CUMULATIVE NO. OF FUNC. EVALS.:       13
 NPARAMETR:  1.2881E+00  7.8413E+00  1.8933E-01  1.3187E+00  3.9057E+00 -2.7871E-01  1.5068E-02 -1.3116E-01  2.7751E-01  1.2204E-02
             6.0249E-01  3.8804E-01  2.9086E-01
 PARAMETER:  1.0000E-01  1.0000E-01  1.0000E-01  1.0000E-01  1.0000E-01  1.0000E-01  1.0000E-01  1.0000E-01  1.0000E-01  1.0000E-01
             1.0000E-01  1.0000E-01  1.0000E-01
 GRADIENT:  -2.1095E+01  2.5308E+01  4.2520E+00 -1.3771E+00 -2.0680E+00  6.7304E+00 -6.6260E+00 -9.8333E+00  1.6426E+00  1.1287E+02
            -2.4779E+00 -5.6386E+00  8.6294E+01

0ITERATION NO.:    5    OBJECTIVE VALUE:   10758.8326539215        NO. OF FUNC. EVALS.:  74
 CUMULATIVE NO. OF FUNC. EVALS.:       87
 NPARAMETR:  1.4545E+00  5.6508E+00  1.6992E-01  1.3439E+00  3.9133E+00 -2.5837E-01  3.2490E-02 -1.2982E-01  2.6573E-01 -2.1519E-02
             5.9029E-01  3.8197E-01  2.7717E-01
 PARAMETER:  2.4669E-01 -9.2813E-01 -1.7903E-02  1.2437E-01  1.0852E-01  1.3167E-01  3.9135E-01  4.8634E-01  7.9441E-02 -2.5320E-01
             8.9773E-02  9.2122E-02  7.5904E-02
 GRADIENT:   1.2720E+01  2.4327E+00 -1.4189E+00  1.1071E-03 -1.1901E+00  6.5145E+00  9.7186E+00 -6.5314E+00  2.0750E+00  1.7463E+01
            -3.3479E+00  2.5443E+01 -2.8033E+01

0ITERATION NO.:   10    OBJECTIVE VALUE:   10755.7050154792        NO. OF FUNC. EVALS.:  70
 CUMULATIVE NO. OF FUNC. EVALS.:      157
 NPARAMETR:  1.4584E+00  5.5576E+00  1.8681E-01  1.3341E+00  3.9595E+00 -2.4717E-01  2.6409E-02 -1.2556E-01  2.0986E-01 -2.1579E-02
             5.7728E-01  3.4782E-01  2.7678E-01
 PARAMETER:  2.4995E-01 -9.6598E-01  8.5436E-02  1.1486E-01  1.6129E-01  1.4879E-01  2.7976E-01  1.1882E+00 -1.6811E-02 -2.5384E-01
             7.8630E-02  4.5288E-02  7.5183E-02
 GRADIENT:   1.3078E+01  3.3896E+00 -1.7267E-01 -2.0737E-01 -1.4466E+00  8.8594E+00  7.0826E+00  4.0202E+00 -4.1795E+00  8.8205E+00
            -5.6062E+00  1.7523E+01 -2.4203E+01

0ITERATION NO.:   15    OBJECTIVE VALUE:   10754.1406963694        NO. OF FUNC. EVALS.:  95
 CUMULATIVE NO. OF FUNC. EVALS.:      252
 NPARAMETR:  1.3940E+00  5.3723E+00  1.9787E-01  1.4852E+00  3.9634E+00 -2.7008E-01  1.2702E-02 -1.2665E-01  2.3178E-01 -2.2918E-02
             5.9471E-01  3.2639E-01  2.7808E-01
 PARAMETER:  1.9490E-01 -1.0407E+00  1.4798E-01  2.5523E-01  1.6591E-01  1.1353E-01  6.6249E-02  1.0501E+00  2.0708E-02 -2.6801E-01
             9.3499E-02  1.3497E-02  7.7533E-02
 GRADIENT:  -6.3764E+00 -6.3816E+00 -2.9553E-01  5.8053E-02 -2.8383E-01  6.9152E-01  3.5457E-01  7.2835E-01 -7.4734E-01 -7.8722E+00
            -1.0014E+00  2.4514E+00 -2.7482E+00

0ITERATION NO.:   20    OBJECTIVE VALUE:   10753.6283290663        NO. OF FUNC. EVALS.: 188
 CUMULATIVE NO. OF FUNC. EVALS.:      440             RESET HESSIAN, TYPE I
 NPARAMETR:  1.4256E+00  5.5757E+00  1.9489E-01  1.4247E+00  4.0075E+00 -2.6657E-01  1.3127E-02 -1.2688E-01  2.3785E-01 -2.0537E-02
             5.9862E-01  3.1206E-01  2.7891E-01
 PARAMETER:  2.2219E-01 -9.5866E-01  1.3150E-01  2.0026E-01  2.1822E-01  1.1898E-01  7.2232E-02  1.0182E+00  3.1153E-02 -2.4282E-01
             9.6774E-02 -8.9603E-03  7.9016E-02
 GRADIENT:   6.3913E+00  6.9590E+00  1.1317E-01  1.9910E-02 -1.5257E-01  7.9764E-01 -1.0289E+00  1.8456E-01  2.2097E-02  3.4270E+00
             1.9807E-02 -3.0384E-01  8.8158E-01

0ITERATION NO.:   25    OBJECTIVE VALUE:   10753.6245179397        NO. OF FUNC. EVALS.: 143
 CUMULATIVE NO. OF FUNC. EVALS.:      583
 NPARAMETR:  1.4238E+00  5.5736E+00  1.9489E-01  1.4247E+00  4.0110E+00 -2.6659E-01  1.3495E-02 -1.2688E-01  2.3793E-01 -2.0543E-02
             5.9866E-01  3.1220E-01  2.7888E-01
 PARAMETER:  2.2064E-01 -9.5949E-01  1.3150E-01  2.0027E-01  2.2245E-01  1.1896E-01  7.7447E-02  1.0186E+00  3.1291E-02 -2.4289E-01
             9.6807E-02 -8.7352E-03  7.8978E-02
 GRADIENT:   5.8015E+00  6.9060E+00  1.0701E-01  2.0712E-02 -1.2396E-01  6.7526E-01 -8.8214E-01  1.9332E-01  9.0891E-02  2.8180E+00
             2.9468E-02 -1.5196E-01  9.7236E-01

0ITERATION NO.:   30    OBJECTIVE VALUE:   10753.6234998007        NO. OF FUNC. EVALS.: 144
 CUMULATIVE NO. OF FUNC. EVALS.:      727
 NPARAMETR:  1.4233E+00  5.5749E+00  1.9488E-01  1.4246E+00  4.0181E+00 -2.6733E-01  1.3520E-02 -1.2688E-01  2.3798E-01 -2.0546E-02
             5.9867E-01  3.1228E-01  2.7888E-01
 PARAMETER:  2.2019E-01 -9.5898E-01  1.3143E-01  2.0019E-01  2.3102E-01  1.1781E-01  7.7794E-02  1.0193E+00  3.1379E-02 -2.4292E-01
             9.6822E-02 -8.5972E-03  7.8973E-02
 GRADIENT:  -2.7925E+00  5.2375E-01  6.6951E-02  2.8170E-02 -4.1087E-02  9.6917E-02 -9.3457E-01  1.2121E-01 -6.8490E-02 -2.1452E+00
             2.2776E-02 -1.2719E-01  4.1784E-01

0ITERATION NO.:   35    OBJECTIVE VALUE:   10753.6155708086        NO. OF FUNC. EVALS.: 178
 CUMULATIVE NO. OF FUNC. EVALS.:      905
 NPARAMETR:  1.4219E+00  5.5863E+00  1.9718E-01  1.4243E+00  4.0220E+00 -2.6763E-01  1.3522E-02 -1.2687E-01  2.3798E-01 -2.0570E-02
             5.9846E-01  3.1238E-01  2.7888E-01
 PARAMETER:  2.1900E-01 -9.5433E-01  1.4417E-01  1.9992E-01  2.3588E-01  1.1734E-01  7.7828E-02  1.0196E+00  3.1368E-02 -2.4317E-01
             9.6643E-02 -8.4441E-03  7.8970E-02
 GRADIENT:  -3.3139E+00  1.1598E+00  2.6850E-01 -5.8962E-02 -3.1139E-02 -6.8811E-03 -1.0429E+00  1.4685E-01 -2.0567E-01 -3.3338E+00
             1.4890E-03 -1.3667E-01  7.6840E-01

0ITERATION NO.:   40    OBJECTIVE VALUE:   10753.6129851093        NO. OF FUNC. EVALS.: 105
 CUMULATIVE NO. OF FUNC. EVALS.:     1010
 NPARAMETR:  1.4125E+00  5.5938E+00  1.9719E-01  1.4217E+00  4.0208E+00 -2.6481E-01  1.3724E-02 -1.2689E-01  2.3871E-01 -2.0568E-02
             5.9835E-01  3.1382E-01  2.7886E-01
 PARAMETER:  2.1095E-01 -9.5132E-01  1.4427E-01  1.9749E-01  2.3434E-01  1.2171E-01  8.0696E-02  1.0174E+00  3.2635E-02 -2.4315E-01
             9.6549E-02 -6.1504E-03  7.8933E-02
 GRADIENT:   4.3882E+00  7.2651E+00  3.3025E-01 -9.3503E-02 -1.6087E-01  1.0670E+00 -6.8693E-01  2.1392E-01  1.8950E-01  4.0272E+00
            -7.3345E-03  5.7220E-01  1.3393E+00

0ITERATION NO.:   45    OBJECTIVE VALUE:   10753.6117579438        NO. OF FUNC. EVALS.: 165
 CUMULATIVE NO. OF FUNC. EVALS.:     1175             RESET HESSIAN, TYPE I
 NPARAMETR:  1.4121E+00  5.5942E+00  1.9720E-01  1.4215E+00  4.0317E+00 -2.6669E-01  1.3735E-02 -1.2689E-01  2.3875E-01 -2.0568E-02
             5.9834E-01  3.1235E-01  2.7886E-01
 PARAMETER:  2.1059E-01 -9.5115E-01  1.4429E-01  1.9735E-01  2.4767E-01  1.1881E-01  8.0849E-02  1.0170E+00  3.2708E-02 -2.4315E-01
             9.6546E-02 -8.4926E-03  7.8930E-02
 GRADIENT:   4.3192E+00  7.2537E+00  2.9773E-01 -7.4457E-02  1.4527E-02  4.9328E-02 -7.4040E-01  1.9082E-01  2.3292E-01  3.5377E+00
            -2.5371E-02 -1.1628E-01  1.4338E+00

0ITERATION NO.:   50    OBJECTIVE VALUE:   10753.6113278513        NO. OF FUNC. EVALS.: 148
 CUMULATIVE NO. OF FUNC. EVALS.:     1323
 NPARAMETR:  1.4122E+00  5.5938E+00  1.9720E-01  1.4216E+00  4.0272E+00 -2.6625E-01  1.3736E-02 -1.2689E-01  2.3876E-01 -2.0567E-02
             5.9836E-01  3.1248E-01  2.7885E-01
 PARAMETER:  2.1070E-01 -9.5129E-01  1.4428E-01  1.9740E-01  2.4223E-01  1.1948E-01  8.0857E-02  1.0167E+00  3.2718E-02 -2.4315E-01
             9.6559E-02 -8.2849E-03  7.8919E-02
 GRADIENT:   4.2452E+00  7.2928E+00  3.1384E-01 -8.0082E-02 -4.1086E-02  3.5007E-01 -7.3311E-01  1.9990E-01  2.2777E-01  3.6367E+00
            -1.4920E-02 -5.2927E-02  1.3368E+00

0ITERATION NO.:   54    OBJECTIVE VALUE:   10753.6112205628        NO. OF FUNC. EVALS.: 150
 CUMULATIVE NO. OF FUNC. EVALS.:     1473
 NPARAMETR:  1.4122E+00  5.5942E+00  1.9719E-01  1.4216E+00  4.0254E+00 -2.6618E-01  1.3735E-02 -1.2689E-01  2.3890E-01 -2.0567E-02
             5.9834E-01  3.1246E-01  2.7885E-01
 PARAMETER:  2.1067E-01 -9.5119E-01  1.4426E-01  1.9742E-01  2.4026E-01  1.1960E-01  8.0846E-02  1.0167E+00  3.2959E-02 -2.4314E-01
             9.6547E-02 -8.3098E-03  7.8905E-02
 GRADIENT:   1.8464E+00 -1.3974E+00 -4.1588E-01  3.6178E-03  9.5192E-03  1.9011E-02 -2.1233E+00 -5.7316E-01  3.1220E+00 -4.5134E-01
             1.5890E-01  1.4189E-01 -3.1883E+00
 NUMSIGDIG:         3.4         3.3         2.9         4.8         1.9         2.8         3.2         3.3         3.3         4.1
                    3.3         3.4         3.3

 #TERM:
0MINIMIZATION TERMINATED
 DUE TO ROUNDING ERRORS (ERROR=134)
 NO. OF FUNCTION EVALUATIONS USED:     1473
 NO. OF SIG. DIGITS IN FINAL EST.:  1.9
 ADDITIONAL PROBLEMS OCCURRED WITH THE MINIMIZATION.
 REGARD THE RESULTS OF THE ESTIMATION STEP CAREFULLY, AND ACCEPT THEM ONLY
 AFTER CHECKING THAT THE COVARIANCE STEP PRODUCES REASONABLE OUTPUT.

 ETABAR IS THE ARITHMETIC MEAN OF THE ETA-ESTIMATES,
 AND THE P-VALUE IS GIVEN FOR THE NULL HYPOTHESIS THAT THE TRUE MEAN IS 0.

 ETABAR:         1.5846E-03  2.7466E-03
 SE:             8.8925E-02  6.3824E-02
 N:                      75          75

 P VAL.:         9.8578E-01  9.6567E-01

 ETASHRINKSD(%)  4.4145E-01  1.1169E+00
 ETASHRINKVR(%)  8.8095E-01  2.2213E+00
 EBVSHRINKSD(%)  4.2500E-01  1.1376E+00
 EBVSHRINKVR(%)  8.4819E-01  2.2622E+00
 RELATIVEINF(%)  9.9134E+01  9.7720E+01
 EPSSHRINKSD(%)  3.8111E+00  3.8111E+00
 EPSSHRINKVR(%)  7.4769E+00  7.4769E+00

  
 TOTAL DATA POINTS NORMALLY DISTRIBUTED (N):         2801
 N*LOG(2PI) CONSTANT TO OBJECTIVE FUNCTION:    5147.8936630125763     
 OBJECTIVE FUNCTION VALUE WITHOUT CONSTANT:    10753.611220562765     
 OBJECTIVE FUNCTION VALUE WITH CONSTANT:       15901.504883575341     
 REPORTED OBJECTIVE FUNCTION DOES NOT CONTAIN CONSTANT
  
 TOTAL EFFECTIVE ETAS (NIND*NETA):                           150
  
 #TERE:
 Elapsed estimation  time in seconds:  2753.84
 Elapsed postprocess time in seconds:     0.00
1
 
 
 
 
 
 
 
 
 
 
 
 
 
 
 
 
 
 
 
 
 ************************************************************************************************************************
 ********************                                                                                ********************
 ********************               FIRST ORDER CONDITIONAL ESTIMATION WITH INTERACTION              ********************
 #OBJT:**************                       MINIMUM VALUE OF OBJECTIVE FUNCTION                      ********************
 ********************                                                                                ********************
 ************************************************************************************************************************
 





 #OBJV:********************************************         10753.611       *********************************************
1
 ************************************************************************************************************************
 ********************                                                                                ********************
 ********************               FIRST ORDER CONDITIONAL ESTIMATION WITH INTERACTION              ********************
 ********************                             FINAL PARAMETER ESTIMATE                           ********************
 ********************                                                                                ********************
 ************************************************************************************************************************
 


 THETA - VECTOR OF FIXED EFFECTS PARAMETERS   *********


         TH 1      TH 2      TH 3      TH 4      TH 5      TH 6      TH 7      TH 8      TH 9      TH10     
 
         1.41E+00  5.59E+00  1.97E-01  1.42E+00  4.03E+00 -2.66E-01  1.37E-02 -1.27E-01  2.39E-01 -2.06E-02
 


 OMEGA - COV MATRIX FOR RANDOM EFFECTS - ETAS  ********


         ETA1      ETA2     
 
 ETA1
+        5.98E-01
 
 ETA2
+        0.00E+00  3.12E-01
 


 SIGMA - COV MATRIX FOR RANDOM EFFECTS - EPSILONS  ****


         EPS1      EPS2     
 
 EPS1
+        2.79E-01
 
 EPS2
+        0.00E+00  5.00E-13
 
1


 OMEGA - CORR MATRIX FOR RANDOM EFFECTS - ETAS  *******


         ETA1      ETA2     
 
 ETA1
+        7.74E-01
 
 ETA2
+        0.00E+00  5.59E-01
 


 SIGMA - CORR MATRIX FOR RANDOM EFFECTS - EPSILONS  ***


         EPS1      EPS2     
 
 EPS1
+        5.28E-01
 
 EPS2
+        0.00E+00  7.07E-07
 
 Elapsed finaloutput time in seconds:     0.00
 #CPUT: Total CPU Time in Seconds,     2747.965
Stop Time:
za 03 jan 2026 15:02:21 CET
